{
  "contractVersion": "0.1",
  "discoveryId": "disc_contoso_sandbox_001",
  "onboardingSessionId": "onb_contoso_sandbox_001",
  "source": "SampleDiscovery",
  "dataPolicy": "InstallReadinessOnly",
  "discoveredAt": "2026-07-05T00:00:00Z",
  "customer": {
    "tenantName": "Contoso Intranet",
    "tenantId": "00000000-0000-0000-0000-000000000000",
    "primaryContact": "admin@contoso.com",
    "verifiedDomains": [
      "contoso.sharepoint.com"
    ]
  },
  "azure": {
    "tenantId": "00000000-0000-0000-0000-000000000000",
    "selectedSubscriptionId": "11111111-1111-1111-1111-111111111111",
    "selectedSubscriptionName": "Subscription 11111111",
    "recommendedLocation": "eastus",
    "targetResourceGroupName": "rg-pagemaker365-contoso-prod",
    "accessibleSubscriptions": [
      {
        "subscriptionId": "11111111-1111-1111-1111-111111111111",
        "displayName": "Subscription 11111111",
        "state": "Unknown"
      }
    ]
  },
  "sharePoint": {
    "tenantHostname": "contoso.sharepoint.com",
    "siteUrl": "https://contoso.sharepoint.com/sites/intranet",
    "siteId": "",
    "siteDisplayName": "",
    "defaultDocumentLibrary": "Documents",
    "defaultDocumentLibraryId": "",
    "permissionMode": "SitesSelected",
    "siteResolved": true,
    "availableDocumentLibraries": []
  },
  "entra": {
    "appRegistrationMode": "Create",
    "consentStatus": "Unknown",
    "permissionMode": "SitesSelected",
    "requiredApplicationPermissions": [
      "Sites.Selected"
    ],
    "requiredDelegatedScopes": [
      "openid",
      "profile",
      "email"
    ]
  },
  "findings": [
    {
      "severity": "Info",
      "code": "DiscoveryPackageFallback",
      "summary": "Discovery starts from bootstrap and install package values.",
      "details": "Live read-only providers can enrich these fields when the required sign-ins and modules are available."
    }
  ]
}
